[
  {
    "domain": "amazon.com",
    "intent": "read",
    "route_used": "browser",
    "result": "aborted_safety",
    "attempted_at": "2026-10-24T09:33:38.021Z",
    "reporter": {
      "operator": "preflight",
      "agent_family": "preflight-synthetic",
      "agent_version": "1.0"
    },
    "self_identified": true,
    "signed_requests": true
  },
  {
    "domain": "ebay.com",
    "intent": "read",
    "route_used": "browser",
    "result": "aborted_safety",
    "attempted_at": "2026-10-24T09:33:38.021Z",
    "reporter": {
      "operator": "preflight",
      "agent_family": "preflight-synthetic",
      "agent_version": "1.0"
    },
    "self_identified": true,
    "signed_requests": true
  },
  {
    "domain": "amazon.co.uk",
    "intent": "read",
    "route_used": "browser",
    "result": "aborted_safety",
    "attempted_at": "2026-10-24T09:33:38.021Z",
    "reporter": {
      "operator": "preflight",
      "agent_family": "preflight-synthetic",
      "agent_version": "1.0"
    },
    "self_identified": true,
    "signed_requests": true
  },
  {
    "domain": "ebay.co.uk",
    "intent": "read",
    "route_used": "browser",
    "result": "aborted_safety",
    "attempted_at": "2026-10-24T09:33:38.021Z",
    "reporter": {
      "operator": "preflight",
      "agent_family": "preflight-synthetic",
      "agent_version": "1.0"
    },
    "self_identified": true,
    "signed_requests": true
  },
  {
    "domain": "etsy.com",
    "intent": "read",
    "route_used": "browser",
    "result": "aborted_safety",
    "attempted_at": "2026-10-24T09:33:38.021Z",
    "reporter": {
      "operator": "preflight",
      "agent_family": "preflight-synthetic",
      "agent_version": "1.0"
    },
    "self_identified": true,
    "signed_requests": true
  },
  {
    "domain": "walmart.com",
    "intent": "read",
    "route_used": "browser",
    "result": "aborted_safety",
    "attempted_at": "2026-10-24T09:33:38.021Z",
    "reporter": {
      "operator": "preflight",
      "agent_family": "preflight-synthetic",
      "agent_version": "1.0"
    },
    "self_identified": true,
    "signed_requests": true
  },
  {
    "domain": "target.com",
    "intent": "read",
    "route_used": "browser",
    "result": "aborted_safety",
    "attempted_at": "2026-10-24T09:33:38.021Z",
    "reporter": {
      "operator": "preflight",
      "agent_family": "preflight-synthetic",
      "agent_version": "1.0"
    },
    "self_identified": true,
    "signed_requests": true
  },
  {
    "domain": "costco.com",
    "intent": "read",
    "route_used": "browser",
    "result": "aborted_safety",
    "attempted_at": "2026-10-24T09:33:38.021Z",
    "reporter": {
      "operator": "preflight",
      "agent_family": "preflight-synthetic",
      "agent_version": "1.0"
    },
    "self_identified": true,
    "signed_requests": true
  },
  {
    "domain": "bestbuy.com",
    "intent": "read",
    "route_used": "browser",
    "result": "aborted_safety",
    "attempted_at": "2026-10-24T09:33:38.021Z",
    "reporter": {
      "operator": "preflight",
      "agent_family": "preflight-synthetic",
      "agent_version": "1.0"
    },
    "self_identified": true,
    "signed_requests": true
  },
  {
    "domain": "newegg.com",
    "intent": "read",
    "route_used": "browser",
    "result": "aborted_safety",
    "attempted_at": "2026-10-24T09:33:38.021Z",
    "reporter": {
      "operator": "preflight",
      "agent_family": "preflight-synthetic",
      "agent_version": "1.0"
    },
    "self_identified": true,
    "signed_requests": true
  },
  {
    "domain": "bhphotovideo.com",
    "intent": "read",
    "route_used": "browser",
    "result": "aborted_safety",
    "attempted_at": "2026-10-24T09:33:38.021Z",
    "reporter": {
      "operator": "preflight",
      "agent_family": "preflight-synthetic",
      "agent_version": "1.0"
    },
    "self_identified": true,
    "signed_requests": true
  },
  {
    "domain": "apple.com",
    "intent": "read",
    "route_used": "browser",
    "result": "aborted_safety",
    "attempted_at": "2026-10-24T09:33:38.021Z",
    "reporter": {
      "operator": "preflight",
      "agent_family": "preflight-synthetic",
      "agent_version": "1.0"
    },
    "self_identified": true,
    "signed_requests": true
  },
  {
    "domain": "samsung.com",
    "intent": "read",
    "route_used": "browser",
    "result": "aborted_safety",
    "attempted_at": "2026-10-24T09:33:38.021Z",
    "reporter": {
      "operator": "preflight",
      "agent_family": "preflight-synthetic",
      "agent_version": "1.0"
    },
    "self_identified": true,
    "signed_requests": true
  },
  {
    "domain": "dell.com",
    "intent": "read",
    "route_used": "browser",
    "result": "aborted_safety",
    "attempted_at": "2026-10-24T09:33:38.021Z",
    "reporter": {
      "operator": "preflight",
      "agent_family": "preflight-synthetic",
      "agent_version": "1.0"
    },
    "self_identified": true,
    "signed_requests": true
  },
  {
    "domain": "lenovo.com",
    "intent": "read",
    "route_used": "browser",
    "result": "aborted_safety",
    "attempted_at": "2026-10-24T09:33:38.021Z",
    "reporter": {
      "operator": "preflight",
      "agent_family": "preflight-synthetic",
      "agent_version": "1.0"
    },
    "self_identified": true,
    "signed_requests": true
  },
  {
    "domain": "homedepot.com",
    "intent": "read",
    "route_used": "browser",
    "result": "aborted_safety",
    "attempted_at": "2026-10-24T09:33:38.021Z",
    "reporter": {
      "operator": "preflight",
      "agent_family": "preflight-synthetic",
      "agent_version": "1.0"
    },
    "self_identified": true,
    "signed_requests": true
  },
  {
    "domain": "lowes.com",
    "intent": "read",
    "route_used": "browser",
    "result": "aborted_safety",
    "attempted_at": "2026-10-24T09:33:38.021Z",
    "reporter": {
      "operator": "preflight",
      "agent_family": "preflight-synthetic",
      "agent_version": "1.0"
    },
    "self_identified": true,
    "signed_requests": true
  },
  {
    "domain": "wayfair.com",
    "intent": "read",
    "route_used": "browser",
    "result": "aborted_safety",
    "attempted_at": "2026-10-24T09:33:38.021Z",
    "reporter": {
      "operator": "preflight",
      "agent_family": "preflight-synthetic",
      "agent_version": "1.0"
    },
    "self_identified": true,
    "signed_requests": true
  },
  {
    "domain": "ikea.com",
    "intent": "read",
    "route_used": "browser",
    "result": "aborted_safety",
    "attempted_at": "2026-10-24T09:33:38.021Z",
    "reporter": {
      "operator": "preflight",
      "agent_family": "preflight-synthetic",
      "agent_version": "1.0"
    },
    "self_identified": true,
    "signed_requests": true
  },
  {
    "domain": "macys.com",
    "intent": "read",
    "route_used": "browser",
    "result": "aborted_safety",
    "attempted_at": "2026-10-24T09:33:38.021Z",
    "reporter": {
      "operator": "preflight",
      "agent_family": "preflight-synthetic",
      "agent_version": "1.0"
    },
    "self_identified": true,
    "signed_requests": true
  },
  {
    "domain": "nordstrom.com",
    "intent": "read",
    "route_used": "browser",
    "result": "aborted_safety",
    "attempted_at": "2026-10-24T09:33:38.021Z",
    "reporter": {
      "operator": "preflight",
      "agent_family": "preflight-synthetic",
      "agent_version": "1.0"
    },
    "self_identified": true,
    "signed_requests": true
  },
  {
    "domain": "gap.com",
    "intent": "read",
    "route_used": "browser",
    "result": "aborted_safety",
    "attempted_at": "2026-10-24T09:33:38.021Z",
    "reporter": {
      "operator": "preflight",
      "agent_family": "preflight-synthetic",
      "agent_version": "1.0"
    },
    "self_identified": true,
    "signed_requests": true
  },
  {
    "domain": "zara.com",
    "intent": "read",
    "route_used": "browser",
    "result": "aborted_safety",
    "attempted_at": "2026-10-24T09:33:38.021Z",
    "reporter": {
      "operator": "preflight",
      "agent_family": "preflight-synthetic",
      "agent_version": "1.0"
    },
    "self_identified": true,
    "signed_requests": true
  },
  {
    "domain": "hm.com",
    "intent": "read",
    "route_used": "browser",
    "result": "aborted_safety",
    "attempted_at": "2026-10-24T09:33:38.021Z",
    "reporter": {
      "operator": "preflight",
      "agent_family": "preflight-synthetic",
      "agent_version": "1.0"
    },
    "self_identified": true,
    "signed_requests": true
  },
  {
    "domain": "uniqlo.com",
    "intent": "read",
    "route_used": "browser",
    "result": "aborted_safety",
    "attempted_at": "2026-10-24T09:33:38.021Z",
    "reporter": {
      "operator": "preflight",
      "agent_family": "preflight-synthetic",
      "agent_version": "1.0"
    },
    "self_identified": true,
    "signed_requests": true
  },
  {
    "domain": "nike.com",
    "intent": "read",
    "route_used": "browser",
    "result": "aborted_safety",
    "attempted_at": "2026-10-24T09:33:38.021Z",
    "reporter": {
      "operator": "preflight",
      "agent_family": "preflight-synthetic",
      "agent_version": "1.0"
    },
    "self_identified": true,
    "signed_requests": true
  },
  {
    "domain": "adidas.com",
    "intent": "read",
    "route_used": "browser",
    "result": "aborted_safety",
    "attempted_at": "2026-10-24T09:33:38.021Z",
    "reporter": {
      "operator": "preflight",
      "agent_family": "preflight-synthetic",
      "agent_version": "1.0"
    },
    "self_identified": true,
    "signed_requests": true
  },
  {
    "domain": "asos.com",
    "intent": "read",
    "route_used": "browser",
    "result": "aborted_safety",
    "attempted_at": "2026-10-24T09:33:38.021Z",
    "reporter": {
      "operator": "preflight",
      "agent_family": "preflight-synthetic",
      "agent_version": "1.0"
    },
    "self_identified": true,
    "signed_requests": true
  },
  {
    "domain": "next.co.uk",
    "intent": "read",